[
  {
    "id": "explore_floresta_da_vila",
    "name": "Pisou em Floresta da Vila",
    "description": "Visite Floresta da Vila pela primeira vez.",
    "category": "exploration",
    "condition": {
      "kind": "visit_zone",
      "target": "floresta_da_vila"
    },
    "reward": {
      "title": "Viajante de Floresta da Vila",
      "ryo": 100
    }
  },
  {
    "id": "explore_costa_das_mares",
    "name": "Pisou em Costa das Marés",
    "description": "Visite Costa das Marés pela primeira vez.",
    "category": "exploration",
    "condition": {
      "kind": "visit_zone",
      "target": "costa_das_mares"
    },
    "reward": {
      "title": "Viajante de Costa das Marés",
      "ryo": 100
    }
  },
  {
    "id": "explore_floresta_da_morte",
    "name": "Pisou em Floresta da Morte",
    "description": "Visite Floresta da Morte pela primeira vez.",
    "category": "exploration",
    "condition": {
      "kind": "visit_zone",
      "target": "floresta_da_morte"
    },
    "reward": {
      "title": "Viajante de Floresta da Morte",
      "ryo": 100
    }
  },
  {
    "id": "explore_ruinas_do_cla_marionetista",
    "name": "Pisou em Ruínas do Clã Marionetista",
    "description": "Visite Ruínas do Clã Marionetista pela primeira vez.",
    "category": "exploration",
    "condition": {
      "kind": "visit_zone",
      "target": "ruinas_do_cla_marionetista"
    },
    "reward": {
      "title": "Viajante de Ruínas do Clã Marionetista",
      "ryo": 100
    }
  },
  {
    "id": "explore_montanha_do_trovao",
    "name": "Pisou em Montanha do Trovão",
    "description": "Visite Montanha do Trovão pela primeira vez.",
    "category": "exploration",
    "condition": {
      "kind": "visit_zone",
      "target": "montanha_do_trovao"
    },
    "reward": {
      "title": "Viajante de Montanha do Trovão",
      "ryo": 100
    }
  },
  {
    "id": "explore_covil_nuvem_vermelha",
    "name": "Pisou em Covil da Nuvem Vermelha",
    "description": "Visite Covil da Nuvem Vermelha pela primeira vez.",
    "category": "exploration",
    "condition": {
      "kind": "visit_zone",
      "target": "covil_nuvem_vermelha"
    },
    "reward": {
      "title": "Viajante de Covil da Nuvem Vermelha",
      "ryo": 100
    }
  },
  {
    "id": "exam_chunin",
    "name": "Aprovado no Exame Chunin",
    "description": "Complete todas as etapas do Exame Chunin.",
    "category": "exam",
    "condition": {
      "kind": "grants_rank",
      "target": "chunin"
    },
    "reward": {
      "title": "Chunin",
      "ryo": 500
    }
  },
  {
    "id": "exam_jonin",
    "name": "Aprovado no Exame Jonin",
    "description": "Complete todas as etapas do Exame Jonin.",
    "category": "exam",
    "condition": {
      "kind": "grants_rank",
      "target": "jonin"
    },
    "reward": {
      "title": "Jonin",
      "ryo": 2000
    }
  },
  {
    "id": "exam_anbu",
    "name": "Aprovado no Exame Anbu",
    "description": "Complete todas as etapas do Exame Anbu.",
    "category": "exam",
    "condition": {
      "kind": "grants_rank",
      "target": "anbu"
    },
    "reward": {
      "title": "Anbu",
      "ryo": 8000
    }
  },
  {
    "id": "exam_kage",
    "name": "Aprovado no Exame Kage",
    "description": "Complete todas as etapas do Exame Kage.",
    "category": "exam",
    "condition": {
      "kind": "grants_rank",
      "target": "kage"
    },
    "reward": {
      "title": "Kage",
      "ryo": 30000
    }
  },
  {
    "id": "chain_floresta_da_vila",
    "name": "História de Floresta da Vila",
    "description": "Complete toda a cadeia de missões de Floresta da Vila (NPC quest_giver_leaf).",
    "category": "quest",
    "condition": {
      "kind": "quest_chain_complete",
      "target": "quest_giver_leaf"
    },
    "reward": {
      "title": "Herói de Floresta da Vila",
      "ryo": 1500
    }
  },
  {
    "id": "chain_costa_das_mares",
    "name": "História de Costa das Marés",
    "description": "Complete toda a cadeia de missões de Costa das Marés (NPC quest_giver_coastal).",
    "category": "quest",
    "condition": {
      "kind": "quest_chain_complete",
      "target": "quest_giver_coastal"
    },
    "reward": {
      "title": "Herói de Costa das Marés",
      "ryo": 1500
    }
  },
  {
    "id": "chain_floresta_da_morte",
    "name": "História de Floresta da Morte",
    "description": "Complete toda a cadeia de missões de Floresta da Morte (NPC quest_giver_swamp).",
    "category": "quest",
    "condition": {
      "kind": "quest_chain_complete",
      "target": "quest_giver_swamp"
    },
    "reward": {
      "title": "Herói de Floresta da Morte",
      "ryo": 1500
    }
  },
  {
    "id": "chain_ruinas_do_cla_marionetista",
    "name": "História de Ruínas do Clã Marionetista",
    "description": "Complete toda a cadeia de missões de Ruínas do Clã Marionetista (NPC quest_giver_ruins).",
    "category": "quest",
    "condition": {
      "kind": "quest_chain_complete",
      "target": "quest_giver_ruins"
    },
    "reward": {
      "title": "Herói de Ruínas do Clã Marionetista",
      "ryo": 1500
    }
  },
  {
    "id": "chain_montanha_do_trovao",
    "name": "História de Montanha do Trovão",
    "description": "Complete toda a cadeia de missões de Montanha do Trovão (NPC quest_giver_mountain).",
    "category": "quest",
    "condition": {
      "kind": "quest_chain_complete",
      "target": "quest_giver_mountain"
    },
    "reward": {
      "title": "Herói de Montanha do Trovão",
      "ryo": 1500
    }
  },
  {
    "id": "chain_covil_nuvem_vermelha",
    "name": "História de Covil da Nuvem Vermelha",
    "description": "Complete toda a cadeia de missões de Covil da Nuvem Vermelha (NPC quest_giver_akatsuki_lair).",
    "category": "quest",
    "condition": {
      "kind": "quest_chain_complete",
      "target": "quest_giver_akatsuki_lair"
    },
    "reward": {
      "title": "Herói de Covil da Nuvem Vermelha",
      "ryo": 1500
    }
  },
  {
    "id": "boss_boss_bandit_chief",
    "name": "Vitória sobre Chefe dos Bandidos",
    "description": "Derrote Chefe dos Bandidos pelo menos uma vez.",
    "category": "boss",
    "condition": {
      "kind": "kill_specific",
      "target": "boss_bandit_chief",
      "count": 1
    },
    "reward": {
      "title": "Algoz de Chefe dos Bandidos",
      "ryo": 200
    }
  },
  {
    "id": "boss_boss_mist_swordsman",
    "name": "Vitória sobre Espadachim da Névoa",
    "description": "Derrote Espadachim da Névoa pelo menos uma vez.",
    "category": "boss",
    "condition": {
      "kind": "kill_specific",
      "target": "boss_mist_swordsman",
      "count": 1
    },
    "reward": {
      "title": "Algoz de Espadachim da Névoa",
      "ryo": 800
    }
  },
  {
    "id": "boss_boss_elder_toad",
    "name": "Vitória sobre Sapo Ancião",
    "description": "Derrote Sapo Ancião pelo menos uma vez.",
    "category": "boss",
    "condition": {
      "kind": "kill_specific",
      "target": "boss_elder_toad",
      "count": 1
    },
    "reward": {
      "title": "Algoz de Sapo Ancião",
      "ryo": 1200
    }
  },
  {
    "id": "boss_boss_white_serpent",
    "name": "Vitória sobre Serpente Branca",
    "description": "Derrote Serpente Branca pelo menos uma vez.",
    "category": "boss",
    "condition": {
      "kind": "kill_specific",
      "target": "boss_white_serpent",
      "count": 1
    },
    "reward": {
      "title": "Algoz de Serpente Branca",
      "ryo": 1500
    }
  },
  {
    "id": "boss_elite_deserter",
    "name": "Vitória sobre Desertor de Elite",
    "description": "Derrote Desertor de Elite pelo menos uma vez.",
    "category": "boss",
    "condition": {
      "kind": "kill_specific",
      "target": "elite_deserter",
      "count": 1
    },
    "reward": {
      "title": "Algoz de Desertor de Elite",
      "ryo": 2000
    }
  },
  {
    "id": "boss_boss_puppeteer",
    "name": "Vitória sobre Marionetista das Ruínas",
    "description": "Derrote Marionetista das Ruínas pelo menos uma vez.",
    "category": "boss",
    "condition": {
      "kind": "kill_specific",
      "target": "boss_puppeteer",
      "count": 1
    },
    "reward": {
      "title": "Algoz de Marionetista das Ruínas",
      "ryo": 3000
    }
  },
  {
    "id": "boss_boss_curse_partner",
    "name": "Vitória sobre O Sócio Eterno",
    "description": "Derrote O Sócio Eterno pelo menos uma vez.",
    "category": "boss",
    "condition": {
      "kind": "kill_specific",
      "target": "boss_curse_partner",
      "count": 1
    },
    "reward": {
      "title": "Algoz de O Sócio Eterno",
      "ryo": 6000
    }
  },
  {
    "id": "boss_boss_ancestral_oni",
    "name": "Vitória sobre Oni Ancestral",
    "description": "Derrote Oni Ancestral pelo menos uma vez.",
    "category": "boss",
    "condition": {
      "kind": "kill_specific",
      "target": "boss_ancestral_oni",
      "count": 1
    },
    "reward": {
      "title": "Algoz de Oni Ancestral",
      "ryo": 12000
    }
  },
  {
    "id": "boss_boss_illusive_eye",
    "name": "Vitória sobre O Vigia Ilusório",
    "description": "Derrote O Vigia Ilusório pelo menos uma vez.",
    "category": "boss",
    "condition": {
      "kind": "kill_specific",
      "target": "boss_illusive_eye",
      "count": 1
    },
    "reward": {
      "title": "Algoz de O Vigia Ilusório",
      "ryo": 15000
    }
  },
  {
    "id": "boss_boss_masked_puppeteer",
    "name": "Vitória sobre O Mascarado das Sombras",
    "description": "Derrote O Mascarado das Sombras pelo menos uma vez.",
    "category": "boss",
    "condition": {
      "kind": "kill_specific",
      "target": "boss_masked_puppeteer",
      "count": 1
    },
    "reward": {
      "title": "Algoz de O Mascarado das Sombras",
      "ryo": 18000
    }
  },
  {
    "id": "boss_boss_rings_bearer",
    "name": "Vitória sobre O Portador dos Seis Caminhos",
    "description": "Derrote O Portador dos Seis Caminhos pelo menos uma vez.",
    "category": "boss",
    "condition": {
      "kind": "kill_specific",